{
    "componentChunkName": "component---src-layouts-post-js",
    "path": "/post/sample/markdown",
    "result": {"data":{"cur":{"slug":"sample/markdown","frontmatter":{"title":"Markdown Sample","date":"Apr 04, 2022","thumbnail":{"publicURL":"/gatsby-starter-spaceful/static/5f4924761129e60923d9a721cf54a508/profile.png"},"tags":["Markdown","MD","With tag"]},"body":"var _excluded = [\"components\"];\n\nfunction _extends() { _extends = Object.assign || function (target) { for (var i = 1; i < arguments.length; i++) { var source = arguments[i]; for (var key in source) { if (Object.prototype.hasOwnProperty.call(source, key)) { target[key] = source[key]; } } } return target; }; return _extends.apply(this, arguments); }\n\nfunction _objectWithoutProperties(source, excluded) { if (source == null) return {}; var target = _objectWithoutPropertiesLoose(source, excluded); var key, i; if (Object.getOwnPropertySymbols) { var sourceSymbolKeys = Object.getOwnPropertySymbols(source); for (i = 0; i < sourceSymbolKeys.length; i++) { key = sourceSymbolKeys[i]; if (excluded.indexOf(key) >= 0) continue; if (!Object.prototype.propertyIsEnumerable.call(source, key)) continue; target[key] = source[key]; } } return target; }\n\nfunction _objectWithoutPropertiesLoose(source, excluded) { if (source == null) return {}; var target = {}; var sourceKeys = Object.keys(source); var key, i; for (i = 0; i < sourceKeys.length; i++) { key = sourceKeys[i]; if (excluded.indexOf(key) >= 0) continue; target[key] = source[key]; } return target; }\n\n/* @jsxRuntime classic */\n\n/* @jsx mdx */\nvar _frontmatter = {\n  \"date\": \"2022-04-04T00:00:00.000Z\",\n  \"title\": \"Markdown Sample\",\n  \"publish\": true,\n  \"tags\": [\"Markdown\", \"MD\", \"With tag\"],\n  \"thumbnail\": \"img/profile.png\"\n};\nvar layoutProps = {\n  _frontmatter: _frontmatter\n};\nvar MDXLayout = \"wrapper\";\nreturn function MDXContent(_ref) {\n  var components = _ref.components,\n      props = _objectWithoutProperties(_ref, _excluded);\n\n  return mdx(MDXLayout, _extends({}, layoutProps, props, {\n    components: components,\n    mdxType: \"MDXLayout\"\n  }), mdx(\"h1\", {\n    \"id\": \"h1-heading-8-\",\n    \"style\": {\n      \"position\": \"relative\"\n    }\n  }, mdx(\"a\", {\n    parentName: \"h1\",\n    \"href\": \"#h1-heading-8-\",\n    \"aria-label\": \"h1 heading 8  permalink\",\n    \"className\": \"anchor before\"\n  }, mdx(\"span\", {\n    parentName: \"a\"\n  }, \"#\")), \"h1 Heading 8-)\"), mdx(\"h2\", {\n    \"id\": \"h2-heading\",\n    \"style\": {\n      \"position\": \"relative\"\n    }\n  }, mdx(\"a\", {\n    parentName: \"h2\",\n    \"href\": \"#h2-heading\",\n    \"aria-label\": \"h2 heading permalink\",\n    \"className\": \"anchor before\"\n  }, mdx(\"span\", {\n    parentName: \"a\"\n  }, \"#\")), \"h2 Heading\"), mdx(\"h3\", {\n    \"id\": \"h3-heading\",\n    \"style\": {\n      \"position\": \"relative\"\n    }\n  }, mdx(\"a\", {\n    parentName: \"h3\",\n    \"href\": \"#h3-heading\",\n    \"aria-label\": \"h3 heading permalink\",\n    \"className\": \"anchor before\"\n  }, mdx(\"span\", {\n    parentName: \"a\"\n  }, \"#\")), \"h3 Heading\"), mdx(\"h4\", {\n    \"id\": \"h4-heading\",\n    \"style\": {\n      \"position\": \"relative\"\n    }\n  }, mdx(\"a\", {\n    parentName: \"h4\",\n    \"href\": \"#h4-heading\",\n    \"aria-label\": \"h4 heading permalink\",\n    \"className\": \"anchor before\"\n  }, mdx(\"span\", {\n    parentName: \"a\"\n  }, \"#\")), \"h4 Heading\"), mdx(\"h5\", {\n    \"id\": \"h5-heading\",\n    \"style\": {\n      \"position\": \"relative\"\n    }\n  }, mdx(\"a\", {\n    parentName: \"h5\",\n    \"href\": \"#h5-heading\",\n    \"aria-label\": \"h5 heading permalink\",\n    \"className\": \"anchor before\"\n  }, mdx(\"span\", {\n    parentName: \"a\"\n  }, \"#\")), \"h5 Heading\"), mdx(\"h6\", {\n    \"id\": \"h6-heading\",\n    \"style\": {\n      \"position\": \"relative\"\n    }\n  }, mdx(\"a\", {\n    parentName: \"h6\",\n    \"href\": \"#h6-heading\",\n    \"aria-label\": \"h6 heading permalink\",\n    \"className\": \"anchor before\"\n  }, mdx(\"span\", {\n    parentName: \"a\"\n  }, \"#\")), \"h6 Heading\"), mdx(\"h2\", {\n    \"id\": \"horizontal-rules\",\n    \"style\": {\n      \"position\": \"relative\"\n    }\n  }, mdx(\"a\", {\n    parentName: \"h2\",\n    \"href\": \"#horizontal-rules\",\n    \"aria-label\": \"horizontal rules permalink\",\n    \"className\": \"anchor before\"\n  }, mdx(\"span\", {\n    parentName: \"a\"\n  }, \"#\")), \"Horizontal Rules\"), mdx(\"hr\", null), mdx(\"hr\", null), mdx(\"hr\", null), mdx(\"h2\", {\n    \"id\": \"emphasis\",\n    \"style\": {\n      \"position\": \"relative\"\n    }\n  }, mdx(\"a\", {\n    parentName: \"h2\",\n    \"href\": \"#emphasis\",\n    \"aria-label\": \"emphasis permalink\",\n    \"className\": \"anchor before\"\n  }, mdx(\"span\", {\n    parentName: \"a\"\n  }, \"#\")), \"Emphasis\"), mdx(\"p\", null, mdx(\"strong\", {\n    parentName: \"p\"\n  }, \"This is bold text\")), mdx(\"p\", null, mdx(\"strong\", {\n    parentName: \"p\"\n  }, \"This is bold text\")), mdx(\"p\", null, mdx(\"em\", {\n    parentName: \"p\"\n  }, \"This is italic text\")), mdx(\"p\", null, mdx(\"em\", {\n    parentName: \"p\"\n  }, \"This is italic text\")), mdx(\"p\", null, mdx(\"del\", {\n    parentName: \"p\"\n  }, \"Strikethrough\")), mdx(\"h2\", {\n    \"id\": \"blockquotes\",\n    \"style\": {\n      \"position\": \"relative\"\n    }\n  }, mdx(\"a\", {\n    parentName: \"h2\",\n    \"href\": \"#blockquotes\",\n    \"aria-label\": \"blockquotes permalink\",\n    \"className\": \"anchor before\"\n  }, mdx(\"span\", {\n    parentName: \"a\"\n  }, \"#\")), \"Blockquotes\"), mdx(\"blockquote\", null, mdx(\"p\", {\n    parentName: \"blockquote\"\n  }, \"Blockquotes can also be nested, but nested blockquotes are ugly.\"), mdx(\"p\", {\n    parentName: \"blockquote\"\n  }, \"May be I will fix it someday in future. :)\")), mdx(\"h2\", {\n    \"id\": \"lists\",\n    \"style\": {\n      \"position\": \"relative\"\n    }\n  }, mdx(\"a\", {\n    parentName: \"h2\",\n    \"href\": \"#lists\",\n    \"aria-label\": \"lists permalink\",\n    \"className\": \"anchor before\"\n  }, mdx(\"span\", {\n    parentName: \"a\"\n  }, \"#\")), \"Lists\"), mdx(\"p\", null, \"Unordered\"), mdx(\"ul\", null, mdx(\"li\", {\n    parentName: \"ul\"\n  }, \"Create a list by starting a line with \", mdx(\"code\", {\n    parentName: \"li\",\n    \"className\": \"language-text\"\n  }, \"+\"), \", \", mdx(\"code\", {\n    parentName: \"li\",\n    \"className\": \"language-text\"\n  }, \"-\"), \", or \", mdx(\"code\", {\n    parentName: \"li\",\n    \"className\": \"language-text\"\n  }, \"*\")), mdx(\"li\", {\n    parentName: \"ul\"\n  }, \"Sub-lists are made by indenting 2 spaces:\", mdx(\"ul\", {\n    parentName: \"li\"\n  }, mdx(\"li\", {\n    parentName: \"ul\"\n  }, \"Marker character change forces new list start:\", mdx(\"ul\", {\n    parentName: \"li\"\n  }, mdx(\"li\", {\n    parentName: \"ul\"\n  }, \"Ac tristique libero volutpat at\")), mdx(\"ul\", {\n    parentName: \"li\"\n  }, mdx(\"li\", {\n    parentName: \"ul\"\n  }, \"Facilisis in pretium nisl aliquet\")), mdx(\"ul\", {\n    parentName: \"li\"\n  }, mdx(\"li\", {\n    parentName: \"ul\"\n  }, \"Nulla volutpat aliquam velit\"))))), mdx(\"li\", {\n    parentName: \"ul\"\n  }, \"Very easy!\")), mdx(\"p\", null, \"Ordered\"), mdx(\"ol\", null, mdx(\"li\", {\n    parentName: \"ol\"\n  }, \"Lorem ipsum dolor sit amet\"), mdx(\"li\", {\n    parentName: \"ol\"\n  }, \"Consectetur adipiscing elit\"), mdx(\"li\", {\n    parentName: \"ol\"\n  }, \"Integer molestie lorem at massa\"), mdx(\"li\", {\n    parentName: \"ol\"\n  }, \"You can use sequential numbers...\"), mdx(\"li\", {\n    parentName: \"ol\"\n  }, \"...or keep all the numbers as \", mdx(\"code\", {\n    parentName: \"li\",\n    \"className\": \"language-text\"\n  }, \"1.\"))), mdx(\"p\", null, \"Start numbering with offset:\"), mdx(\"ol\", {\n    \"start\": 57\n  }, mdx(\"li\", {\n    parentName: \"ol\"\n  }, \"foo\"), mdx(\"li\", {\n    parentName: \"ol\"\n  }, \"bar\")), mdx(\"h2\", {\n    \"id\": \"code\",\n    \"style\": {\n      \"position\": \"relative\"\n    }\n  }, mdx(\"a\", {\n    parentName: \"h2\",\n    \"href\": \"#code\",\n    \"aria-label\": \"code permalink\",\n    \"className\": \"anchor before\"\n  }, mdx(\"span\", {\n    parentName: \"a\"\n  }, \"#\")), \"Code\"), mdx(\"p\", null, \"Inline \", mdx(\"code\", {\n    parentName: \"p\",\n    \"className\": \"language-js\"\n  }, mdx(\"span\", {\n    parentName: \"code\",\n    \"className\": \"token keyword\"\n  }, \"let\"), \" code \", mdx(\"span\", {\n    parentName: \"code\",\n    \"className\": \"token operator\"\n  }, \"=\"), \" \", mdx(\"span\", {\n    parentName: \"code\",\n    \"className\": \"token string\"\n  }, \"\\\"hello\\\"\"), mdx(\"span\", {\n    parentName: \"code\",\n    \"className\": \"token punctuation\"\n  }, \";\"))), mdx(\"p\", null, \"Indented code\"), mdx(\"div\", {\n    \"className\": \"gatsby-highlight\",\n    \"data-language\": \"text\"\n  }, mdx(\"pre\", {\n    parentName: \"div\",\n    \"className\": \"language-text\"\n  }, mdx(\"code\", {\n    parentName: \"pre\",\n    \"className\": \"language-text\"\n  }, \"// Some comments\\nline 1 of code\\nline 2 of code\\nline 3 of code\"))), mdx(\"p\", null, \"Block code \\\"fences\\\"\"), mdx(\"div\", {\n    \"className\": \"gatsby-highlight\",\n    \"data-language\": \"text\"\n  }, mdx(\"pre\", {\n    parentName: \"div\",\n    \"className\": \"language-text\"\n  }, mdx(\"code\", {\n    parentName: \"pre\",\n    \"className\": \"language-text\"\n  }, \"Sample text here...\"))), mdx(\"p\", null, \"Syntax highlighting\"), mdx(\"div\", {\n    \"className\": \"gatsby-highlight\",\n    \"data-language\": \"js\"\n  }, mdx(\"pre\", {\n    parentName: \"div\",\n    \"className\": \"language-js\"\n  }, mdx(\"code\", {\n    parentName: \"pre\",\n    \"className\": \"language-js\"\n  }, mdx(\"span\", {\n    parentName: \"code\",\n    \"className\": \"token keyword\"\n  }, \"var\"), \" \", mdx(\"span\", {\n    parentName: \"code\",\n    \"className\": \"token function-variable function\"\n  }, \"foo\"), \" \", mdx(\"span\", {\n    parentName: \"code\",\n    \"className\": \"token operator\"\n  }, \"=\"), \" \", mdx(\"span\", {\n    parentName: \"code\",\n    \"className\": \"token keyword\"\n  }, \"function\"), \" \", mdx(\"span\", {\n    parentName: \"code\",\n    \"className\": \"token punctuation\"\n  }, \"(\"), mdx(\"span\", {\n    parentName: \"code\",\n    \"className\": \"token parameter\"\n  }, \"bar\"), mdx(\"span\", {\n    parentName: \"code\",\n    \"className\": \"token punctuation\"\n  }, \")\"), \" \", mdx(\"span\", {\n    parentName: \"code\",\n    \"className\": \"token punctuation\"\n  }, \"{\"), \"\\n  \", mdx(\"span\", {\n    parentName: \"code\",\n    \"className\": \"token keyword\"\n  }, \"return\"), \" bar\", mdx(\"span\", {\n    parentName: \"code\",\n    \"className\": \"token operator\"\n  }, \"++\"), \"\\n\", mdx(\"span\", {\n    parentName: \"code\",\n    \"className\": \"token punctuation\"\n  }, \"}\"), \"\\n\\nconsole\", mdx(\"span\", {\n    parentName: \"code\",\n    \"className\": \"token punctuation\"\n  }, \".\"), mdx(\"span\", {\n    parentName: \"code\",\n    \"className\": \"token function\"\n  }, \"log\"), mdx(\"span\", {\n    parentName: \"code\",\n    \"className\": \"token punctuation\"\n  }, \"(\"), mdx(\"span\", {\n    parentName: \"code\",\n    \"className\": \"token function\"\n  }, \"foo\"), mdx(\"span\", {\n    parentName: \"code\",\n    \"className\": \"token punctuation\"\n  }, \"(\"), mdx(\"span\", {\n    parentName: \"code\",\n    \"className\": \"token number\"\n  }, \"5\"), mdx(\"span\", {\n    parentName: \"code\",\n    \"className\": \"token punctuation\"\n  }, \")\"), mdx(\"span\", {\n    parentName: \"code\",\n    \"className\": \"token punctuation\"\n  }, \")\")))), mdx(\"h2\", {\n    \"id\": \"tables\",\n    \"style\": {\n      \"position\": \"relative\"\n    }\n  }, mdx(\"a\", {\n    parentName: \"h2\",\n    \"href\": \"#tables\",\n    \"aria-label\": \"tables permalink\",\n    \"className\": \"anchor before\"\n  }, mdx(\"span\", {\n    parentName: \"a\"\n  }, \"#\")), \"Tables\"), mdx(\"table\", null, mdx(\"thead\", {\n    parentName: \"table\"\n  }, mdx(\"tr\", {\n    parentName: \"thead\"\n  }, mdx(\"th\", {\n    parentName: \"tr\",\n    \"align\": null\n  }, \"Option\"), mdx(\"th\", {\n    parentName: \"tr\",\n    \"align\": null\n  }, \"Description\"))), mdx(\"tbody\", {\n    parentName: \"table\"\n  }, mdx(\"tr\", {\n    parentName: \"tbody\"\n  }, mdx(\"td\", {\n    parentName: \"tr\",\n    \"align\": null\n  }, \"data\"), mdx(\"td\", {\n    parentName: \"tr\",\n    \"align\": null\n  }, \"path to data files to supply the data that will be passed into templates.\")), mdx(\"tr\", {\n    parentName: \"tbody\"\n  }, mdx(\"td\", {\n    parentName: \"tr\",\n    \"align\": null\n  }, \"engine\"), mdx(\"td\", {\n    parentName: \"tr\",\n    \"align\": null\n  }, \"engine to be used for processing templates. Handlebars is the default.\")), mdx(\"tr\", {\n    parentName: \"tbody\"\n  }, mdx(\"td\", {\n    parentName: \"tr\",\n    \"align\": null\n  }, \"ext\"), mdx(\"td\", {\n    parentName: \"tr\",\n    \"align\": null\n  }, \"extension to be used for dest files.\")))), mdx(\"p\", null, \"Right aligned columns\"), mdx(\"table\", null, mdx(\"thead\", {\n    parentName: \"table\"\n  }, mdx(\"tr\", {\n    parentName: \"thead\"\n  }, mdx(\"th\", {\n    parentName: \"tr\",\n    \"align\": \"right\"\n  }, \"Option\"), mdx(\"th\", {\n    parentName: \"tr\",\n    \"align\": \"right\"\n  }, \"Description\"))), mdx(\"tbody\", {\n    parentName: \"table\"\n  }, mdx(\"tr\", {\n    parentName: \"tbody\"\n  }, mdx(\"td\", {\n    parentName: \"tr\",\n    \"align\": \"right\"\n  }, \"data\"), mdx(\"td\", {\n    parentName: \"tr\",\n    \"align\": \"right\"\n  }, \"path to data files to supply the data that will be passed into templates.\")), mdx(\"tr\", {\n    parentName: \"tbody\"\n  }, mdx(\"td\", {\n    parentName: \"tr\",\n    \"align\": \"right\"\n  }, \"engine\"), mdx(\"td\", {\n    parentName: \"tr\",\n    \"align\": \"right\"\n  }, \"engine to be used for processing templates. Handlebars is the default.\")), mdx(\"tr\", {\n    parentName: \"tbody\"\n  }, mdx(\"td\", {\n    parentName: \"tr\",\n    \"align\": \"right\"\n  }, \"ext\"), mdx(\"td\", {\n    parentName: \"tr\",\n    \"align\": \"right\"\n  }, \"extension to be used for dest files.\")))), mdx(\"h2\", {\n    \"id\": \"links\",\n    \"style\": {\n      \"position\": \"relative\"\n    }\n  }, mdx(\"a\", {\n    parentName: \"h2\",\n    \"href\": \"#links\",\n    \"aria-label\": \"links permalink\",\n    \"className\": \"anchor before\"\n  }, mdx(\"span\", {\n    parentName: \"a\"\n  }, \"#\")), \"Links\"), mdx(\"p\", null, mdx(\"a\", {\n    parentName: \"p\",\n    \"href\": \"https://galacsh.github.io/gatsby-starter-spaceful\"\n  }, \"link text\")), mdx(\"p\", null, \"Autoconverted link \", mdx(\"a\", {\n    parentName: \"p\",\n    \"href\": \"https://github.com/nodeca/pica\"\n  }, \"https://github.com/nodeca/pica\"), \" (enable linkify to see)\"), mdx(\"h2\", {\n    \"id\": \"images\",\n    \"style\": {\n      \"position\": \"relative\"\n    }\n  }, mdx(\"a\", {\n    parentName: \"h2\",\n    \"href\": \"#images\",\n    \"aria-label\": \"images permalink\",\n    \"className\": \"anchor before\"\n  }, mdx(\"span\", {\n    parentName: \"a\"\n  }, \"#\")), \"Images\"), mdx(\"p\", null, mdx(\"span\", {\n    parentName: \"p\",\n    \"className\": \"gatsby-resp-image-wrapper\",\n    \"style\": {\n      \"position\": \"relative\",\n      \"display\": \"block\",\n      \"marginLeft\": \"auto\",\n      \"marginRight\": \"auto\",\n      \"maxWidth\": \"512px\"\n    }\n  }, \"\\n      \", mdx(\"span\", {\n    parentName: \"span\",\n    \"className\": \"gatsby-resp-image-background-image\",\n    \"style\": {\n      \"paddingBottom\": \"100%\",\n      \"position\": \"relative\",\n      \"bottom\": \"0\",\n      \"left\": \"0\",\n      \"display\": \"block\"\n    }\n  }), \"\\n  \", mdx(\"img\", {\n    parentName: \"span\",\n    \"className\": \"gatsby-resp-image-image\",\n    \"alt\": \"icon\",\n    \"title\": \"icon\",\n    \"src\": \"/gatsby-starter-spaceful/static/5f4924761129e60923d9a721cf54a508/01e7c/profile.png\",\n    \"srcSet\": [\"/gatsby-starter-spaceful/static/5f4924761129e60923d9a721cf54a508/772e8/profile.png 200w\", \"/gatsby-starter-spaceful/static/5f4924761129e60923d9a721cf54a508/e17e5/profile.png 400w\", \"/gatsby-starter-spaceful/static/5f4924761129e60923d9a721cf54a508/01e7c/profile.png 512w\"],\n    \"sizes\": \"(max-width: 512px) 100vw, 512px\",\n    \"style\": {\n      \"width\": \"100%\",\n      \"height\": \"100%\",\n      \"margin\": \"0\",\n      \"verticalAlign\": \"middle\",\n      \"position\": \"absolute\",\n      \"top\": \"0\",\n      \"left\": \"0\"\n    },\n    \"loading\": \"lazy\",\n    \"decoding\": \"async\"\n  }), \"\\n    \"), \"\\n\", mdx(\"span\", {\n    parentName: \"p\",\n    \"className\": \"gatsby-resp-image-wrapper\",\n    \"style\": {\n      \"position\": \"relative\",\n      \"display\": \"block\",\n      \"marginLeft\": \"auto\",\n      \"marginRight\": \"auto\",\n      \"maxWidth\": \"192px\"\n    }\n  }, \"\\n      \", mdx(\"span\", {\n    parentName: \"span\",\n    \"className\": \"gatsby-resp-image-background-image\",\n    \"style\": {\n      \"paddingBottom\": \"100%\",\n      \"position\": \"relative\",\n      \"bottom\": \"0\",\n      \"left\": \"0\",\n      \"display\": \"block\"\n    }\n  }), \"\\n  \", mdx(\"img\", {\n    parentName: \"span\",\n    \"className\": \"gatsby-resp-image-image\",\n    \"alt\": \"profile\",\n    \"title\": \"The profile\",\n    \"src\": \"/gatsby-starter-spaceful/static/9e7299d1f4e44b943f3e4f53ff4c0fed/8514f/icon.png\",\n    \"srcSet\": [\"/gatsby-starter-spaceful/static/9e7299d1f4e44b943f3e4f53ff4c0fed/8514f/icon.png 192w\"],\n    \"sizes\": \"(max-width: 192px) 100vw, 192px\",\n    \"style\": {\n      \"width\": \"100%\",\n      \"height\": \"100%\",\n      \"margin\": \"0\",\n      \"verticalAlign\": \"middle\",\n      \"position\": \"absolute\",\n      \"top\": \"0\",\n      \"left\": \"0\"\n    },\n    \"loading\": \"lazy\",\n    \"decoding\": \"async\"\n  }), \"\\n    \")), mdx(\"p\", null, \"Like links, Images also have a footnote style syntax\"), mdx(\"p\", null, mdx(\"span\", {\n    parentName: \"p\",\n    \"className\": \"gatsby-resp-image-wrapper\",\n    \"style\": {\n      \"position\": \"relative\",\n      \"display\": \"block\",\n      \"marginLeft\": \"auto\",\n      \"marginRight\": \"auto\",\n      \"maxWidth\": \"192px\"\n    }\n  }, \"\\n      \", mdx(\"span\", {\n    parentName: \"span\",\n    \"className\": \"gatsby-resp-image-background-image\",\n    \"style\": {\n      \"paddingBottom\": \"100%\",\n      \"position\": \"relative\",\n      \"bottom\": \"0\",\n      \"left\": \"0\",\n      \"display\": \"block\"\n    }\n  }), \"\\n  \", mdx(\"img\", {\n    parentName: \"span\",\n    \"className\": \"gatsby-resp-image-image\",\n    \"alt\": \"Alt text\",\n    \"title\": \"The Dojocat\",\n    \"src\": \"/gatsby-starter-spaceful/static/9e7299d1f4e44b943f3e4f53ff4c0fed/8514f/icon.png\",\n    \"srcSet\": [\"/gatsby-starter-spaceful/static/9e7299d1f4e44b943f3e4f53ff4c0fed/8514f/icon.png 192w\"],\n    \"sizes\": \"(max-width: 192px) 100vw, 192px\",\n    \"style\": {\n      \"width\": \"100%\",\n      \"height\": \"100%\",\n      \"margin\": \"0\",\n      \"verticalAlign\": \"middle\",\n      \"position\": \"absolute\",\n      \"top\": \"0\",\n      \"left\": \"0\"\n    },\n    \"loading\": \"lazy\",\n    \"decoding\": \"async\"\n  }), \"\\n    \")), mdx(\"p\", null, \"With a reference later in the document defining the URL location:\"), mdx(\"h3\", {\n    \"id\": \"footnotes\",\n    \"style\": {\n      \"position\": \"relative\"\n    }\n  }, mdx(\"a\", {\n    parentName: \"h3\",\n    \"href\": \"#footnotes\",\n    \"aria-label\": \"footnotes permalink\",\n    \"className\": \"anchor before\"\n  }, mdx(\"span\", {\n    parentName: \"a\"\n  }, \"#\")), \"Footnotes\"), mdx(\"p\", null, \"Footnote 1 link \", mdx(\"sup\", {\n    parentName: \"p\",\n    \"id\": \"fnref-first\"\n  }, mdx(\"a\", {\n    parentName: \"sup\",\n    \"href\": \"#fn-first\",\n    \"className\": \"footnote-ref\"\n  }, \"first\")), \".\", mdx(\"br\", {\n    parentName: \"p\"\n  }), \"\\n\", \"Footnote 2 link \", mdx(\"sup\", {\n    parentName: \"p\",\n    \"id\": \"fnref-second\"\n  }, mdx(\"a\", {\n    parentName: \"sup\",\n    \"href\": \"#fn-second\",\n    \"className\": \"footnote-ref\"\n  }, \"second\")), \".\", mdx(\"br\", {\n    parentName: \"p\"\n  }), \"\\n\", \"Duplicated footnote reference \", mdx(\"sup\", {\n    parentName: \"p\",\n    \"id\": \"fnref-second\"\n  }, mdx(\"a\", {\n    parentName: \"sup\",\n    \"href\": \"#fn-second\",\n    \"className\": \"footnote-ref\"\n  }, \"second\")), \".\"), mdx(\"div\", {\n    \"className\": \"footnotes\"\n  }, mdx(\"hr\", {\n    parentName: \"div\"\n  }), mdx(\"ol\", {\n    parentName: \"div\"\n  }, mdx(\"li\", {\n    parentName: \"ol\",\n    \"id\": \"fn-first\"\n  }, mdx(\"p\", {\n    parentName: \"li\"\n  }, \"Footnote \", mdx(\"strong\", {\n    parentName: \"p\"\n  }, \"can have markup\")), mdx(\"p\", {\n    parentName: \"li\"\n  }, \"and multiple paragraphs.\", mdx(\"a\", {\n    parentName: \"p\",\n    \"href\": \"#fnref-first\",\n    \"className\": \"footnote-backref\"\n  }, \"\\u21A9\"))), mdx(\"li\", {\n    parentName: \"ol\",\n    \"id\": \"fn-second\"\n  }, mdx(\"p\", {\n    parentName: \"li\"\n  }, \"Footnote text.\", mdx(\"a\", {\n    parentName: \"p\",\n    \"href\": \"#fnref-second\",\n    \"className\": \"footnote-backref\"\n  }, \"\\u21A9\"))))));\n}\n;\nMDXContent.isMDXComponent = true;","tableOfContents":{"items":[{"url":"#h1-heading-8-","title":"h1 Heading 8-)","items":[{"url":"#h2-heading","title":"h2 Heading","items":[{"url":"#h3-heading","title":"h3 Heading","items":[{"url":"#h4-heading","title":"h4 Heading","items":[{"url":"#h5-heading","title":"h5 Heading","items":[{"url":"#h6-heading","title":"h6 Heading"}]}]}]}]},{"url":"#horizontal-rules","title":"Horizontal Rules"},{"url":"#emphasis","title":"Emphasis"},{"url":"#blockquotes","title":"Blockquotes"},{"url":"#lists","title":"Lists"},{"url":"#code","title":"Code"},{"url":"#tables","title":"Tables"},{"url":"#links","title":"Links"},{"url":"#images","title":"Images","items":[{"url":"#footnotes","title":"Footnotes"}]}]}]},"excerpt":"h1 Heading 8-) h2 Heading h3 Heading h4 Heading h5 Heading h6 Heading Horizontal Rules Emphasis Thi…"},"prev":{"slug":"see","frontmatter":{"title":"See"}},"next":null},"pageContext":{"prev":"see","cur":"sample/markdown","next":null}},
    "staticQueryHashes": ["2194892585","3341403432"]}